{
  "id": "10.15556/ijsim.02.02.004",
  "theme": "non_classe",
  "type_etude": "inconnu",
  "message_clinique": "Marketing stratégique. Pas d’usage MSK.",
  "statut": "valide",
  "doi_url": "https://doi.org/10.15556/ijsim.02.02.004",
  "publication_date": "2115-01-01",
  "last_verified": "2025-09-19",
  "retraction_status": "ok",
  "evidence_level": {
    "scale": "unknown",
    "value": "unknown",
    "justification": "Marketing stratégique. Pas d’usage MSK."
  },
  "sources_snapshot": "[{\"title\": \"Publisher page\", \"url\": \"https://doi.org/10.15556/ijsim.02.02.004\", \"publisher\": \"i-das\", \"accessed_at\": \"2025-09-19\", \"strength\": 3}]"
}
