{
  "id": "KI-011-02",
  "theme": "pronostic",
  "type_etude": "inconnu",
  "message_clinique": "Étude observationnelle : obésité et diabète associés à la capsulite rétractile de l’épaule et à la chirurgie.",
  "statut": "valide",
  "doi_url": "https://doi.org/10.1016/j.jse.2018.04.004",
  "pmid": "29807717",
  "publication_date": "2018-01-01",
  "last_verified": "2025-09-18",
  "retraction_status": "ok",
  "evidence_level": {
    "scale": "unknown",
    "value": "unknown",
    "justification": "Étude observationnelle : obésité et diabète associés à la capsulite rétractile de l’épaule et à la chirurgie."
  },
  "sources_snapshot": "[{\"title\": \"Publisher page\", \"url\": \"https://www.sciencedirect.com/science/article/pii/S1058274618302568\", \"publisher\": \"Elsevier / Journal of Shoulder and Elbow Surgery\", \"accessed_at\": \"2025-09-17\", \"strength\": 3}, {\"title\": \"PubMed\", \"url\": \"https://pubmed.ncbi.nlm.nih.gov/29807717/\", \"publisher\": \"NLM / PubMed\", \"accessed_at\": \"2025-09-17\", \"strength\": 2}]"
}
