{
  "id": "10.1080/14767058.2018.1512574",
  "theme": "non_classe",
  "type_etude": "inconnu",
  "message_clinique": "Perineal massage during labor: a systematic review and meta-analysis",
  "statut": "brouillon",
  "pmid": "30107756",
  "sources_snapshot": "[{\"title\": \"PubMed\", \"url\": \"https://pubmed.ncbi.nlm.nih.gov/30107756/\", \"publisher\": \"PubMed\", \"accessed_at\": \"2025-09-17\", \"strength\": 5}, {\"title\": \"T&F article page\", \"url\": \"https://www.tandfonline.com/doi/full/10.1080/14767058.2018.1512574\", \"publisher\": \"Taylor & Francis\", \"accessed_at\": \"2025-09-17\", \"strength\": 4}]"
}
