{
  "id": "10.5455/ijbh.2023.11.216-226",
  "theme": "non_classe",
  "type_etude": "inconnu",
  "message_clinique": "Article satisfaction/qualité. Non clinique MSK.",
  "statut": "valide",
  "doi_url": "https://doi.org/10.5455/ijbh.2023.11.216-226",
  "pmid": "36448968",
  "publication_date": "2200-01-01",
  "last_verified": "2025-09-19",
  "retraction_status": "ok",
  "evidence_level": {
    "scale": "unknown",
    "value": "unknown",
    "justification": "Article satisfaction/qualité. Non clinique MSK."
  },
  "sources_snapshot": "[{\"title\": \"Publisher page\", \"url\": \"https://doi.org/10.5455/ijbh.2023.11.216-226\", \"publisher\": \"ScopeMed\", \"accessed_at\": \"2025-09-19\", \"strength\": 3}, {\"title\": \"PubMed\", \"url\": \"https://pubmed.ncbi.nlm.nih.gov/36448968/\", \"publisher\": \"NLM / PubMed\", \"accessed_at\": \"2025-09-19\", \"strength\": 2}]"
}
