{
  "id": "10.1002/14651858.cd009790.pub2",
  "theme": "non_classe",
  "type_etude": "inconnu",
  "message_clinique": "Exercice probablement efficace sur la douleur vs soins usuels/placebo en lombalgie chronique. Effets faibles à modérés sur fonction.",
  "statut": "valide",
  "doi_url": "https://doi.org/10.1002/14651858.cd009790.pub2",
  "pmid": "34580864",
  "publication_date": "2021-01-01",
  "last_verified": "2025-09-18",
  "retraction_status": "ok",
  "evidence_level": {
    "scale": "unknown",
    "value": "unknown",
    "justification": "Exercice probablement efficace sur la douleur vs soins usuels/placebo en lombalgie chronique. Effets faibles à modérés sur fonction."
  },
  "sources_snapshot": "[{\"title\": \"Publisher page\", \"url\": \"https://doi.org/10.1002/14651858.cd009790.pub2\", \"publisher\": \"Wiley\", \"accessed_at\": \"2025-09-19\", \"strength\": 3}, {\"title\": \"PubMed\", \"url\": \"https://pubmed.ncbi.nlm.nih.gov/34580864/\", \"publisher\": \"NLM / PubMed\", \"accessed_at\": \"2025-09-19\", \"strength\": 2}]"
}
