{
  "id": "10.12775/mbs.2016.008",
  "theme": "douleur_epaule",
  "type_etude": "inconnu",
  "message_clinique": "Étude de concordance examen clinique vs arthroscopie pour LHBT. À valider avant usage.",
  "statut": "valide",
  "doi_url": "https://doi.org/10.12775/mbs.2016.008",
  "publication_date": "2016-01-01",
  "last_verified": "2025-09-19",
  "retraction_status": "ok",
  "evidence_level": {
    "scale": "unknown",
    "value": "unknown",
    "justification": "Étude de concordance examen clinique vs arthroscopie pour LHBT. À valider avant usage."
  },
  "sources_snapshot": "[{\"title\": \"Publisher page\", \"url\": \"https://doi.org/10.12775/mbs.2016.008\", \"publisher\": \"Uniwersytet Mikolaja Kopernika/Nicolaus Copernicus University\", \"accessed_at\": \"2025-09-19\", \"strength\": 3}]"
}
