{
  "id": "10.1007/s10926-020-09879-x",
  "theme": "non_classe",
  "type_etude": "inconnu",
  "message_clinique": "Au travail physique, les programmes d’exercice structurés et mesures organisationnelles améliorent douleur/capacité. Guide le choix d’interventions en milieu pro.",
  "statut": "valide",
  "doi_url": "https://doi.org/10.1007/s10926-020-09879-x",
  "pmid": "32219688",
  "publication_date": "2020-01-01",
  "last_verified": "2025-09-18",
  "retraction_status": "ok",
  "evidence_level": {
    "scale": "unknown",
    "value": "unknown",
    "justification": "Au travail physique, les programmes d’exercice structurés et mesures organisationnelles améliorent douleur/capacité. Guide le choix d’interventions en milieu pro."
  },
  "sources_snapshot": "[{\"title\": \"Publisher page\", \"url\": \"https://doi.org/10.1007/s10926-020-09879-x\", \"publisher\": \"Springer Science and Business Media LLC\", \"accessed_at\": \"2025-09-19\", \"strength\": 3}, {\"title\": \"PubMed\", \"url\": \"https://pubmed.ncbi.nlm.nih.gov/32219688/\", \"publisher\": \"NLM / PubMed\", \"accessed_at\": \"2025-09-19\", \"strength\": 2}]"
}
