{
  "id": "KI-015-06",
  "theme": "drapeaux_rouges",
  "type_etude": "inconnu",
  "message_clinique": "Étude populationnelle cas‑témoins/cas‑croisés : pas d’excès de risque d’AVB associé aux soins chiropratiques vs soins primaires.",
  "statut": "valide",
  "doi_url": "https://doi.org/10.1097/brs.0b013e3181644600",
  "pmid": "18204390",
  "publication_date": "2008-01-01",
  "last_verified": "2025-09-17",
  "retraction_status": "ok",
  "evidence_level": {
    "scale": "unknown",
    "value": "unknown",
    "justification": "Étude populationnelle cas‑témoins/cas‑croisés : pas d’excès de risque d’AVB associé aux soins chiropratiques vs soins primaires."
  },
  "sources_snapshot": "[{\"title\": \"Publisher page\", \"url\": \"https://journals.lww.com/spinejournal/fulltext/2008/02151/risk_of_vertebrobasilar_stroke_and_chiropractic.19.aspx\", \"publisher\": \"LWW / Spine\", \"accessed_at\": \"2025-09-17\", \"strength\": 3}, {\"title\": \"PubMed\", \"url\": \"https://pubmed.ncbi.nlm.nih.gov/18204390/\", \"publisher\": \"NLM / PubMed\", \"accessed_at\": \"2025-09-17\", \"strength\": 2}]"
}
