{
  "id": "KI-008-09",
  "theme": "pronostic",
  "type_etude": "inconnu",
  "message_clinique": "Revue systématique : performance des modèles pronostiques chez les patients lombalgiques traités de façon conservative.",
  "statut": "valide",
  "doi_url": "https://doi.org/10.1016/j.jclinepi.2024.111593",
  "pmid": "39522740",
  "publication_date": "2025-01-01",
  "last_verified": "2025-09-17",
  "retraction_status": "ok",
  "evidence_level": {
    "scale": "unknown",
    "value": "unknown",
    "justification": "Revue systématique : performance des modèles pronostiques chez les patients lombalgiques traités de façon conservative."
  },
  "sources_snapshot": "[{\"title\": \"Publisher page\", \"url\": \"https://www.sciencedirect.com/science/article/pii/S0895435624003494\", \"publisher\": \"Elsevier / Journal of Clinical Epidemiology\", \"accessed_at\": \"2025-09-17\", \"strength\": 3}, {\"title\": \"PubMed\", \"url\": \"https://pubmed.ncbi.nlm.nih.gov/39522740/\", \"publisher\": \"NLM / PubMed\", \"accessed_at\": \"2025-09-17\", \"strength\": 2}]"
}
