{
  "id": "10.1007/s00586-006-0225-6",
  "theme": "non_classe",
  "type_etude": "inconnu",
  "message_clinique": "Synthèse de l’exactitude diagnostique des tests cervicaux utiles pour suspecter une radiculopathie. Aide à choisir les tests cliniques les plus informatifs.",
  "statut": "valide",
  "doi_url": "https://doi.org/10.1007/s00586-006-0225-6",
  "pmid": "17013656",
  "publication_date": "2006-01-01",
  "last_verified": "2025-09-18",
  "retraction_status": "ok",
  "evidence_level": {
    "scale": "unknown",
    "value": "unknown",
    "justification": "Synthèse de l’exactitude diagnostique des tests cervicaux utiles pour suspecter une radiculopathie. Aide à choisir les tests cliniques les plus informatifs."
  },
  "sources_snapshot": "[{\"title\": \"Publisher page\", \"url\": \"https://doi.org/10.1007/s00586-006-0225-6\", \"publisher\": \"Springer Science and Business Media LLC\", \"accessed_at\": \"2025-09-19\", \"strength\": 3}, {\"title\": \"PubMed\", \"url\": \"https://pubmed.ncbi.nlm.nih.gov/17013656/\", \"publisher\": \"NLM / PubMed\", \"accessed_at\": \"2025-09-19\", \"strength\": 2}]"
}
