{
  "id": "KI-012-08",
  "theme": "pronostic",
  "type_etude": "inconnu",
  "message_clinique": "Revue systématique : croyances d’évitement de la douleur comme facteur pronostique d’issue en lombalgie non spécifique.",
  "statut": "valide",
  "doi_url": "https://doi.org/10.1016/j.spinee.2013.09.036",
  "pmid": "24412032",
  "publication_date": "2014-01-01",
  "last_verified": "2025-09-18",
  "retraction_status": "ok",
  "evidence_level": {
    "scale": "unknown",
    "value": "unknown",
    "justification": "Revue systématique : croyances d’évitement de la douleur comme facteur pronostique d’issue en lombalgie non spécifique."
  },
  "sources_snapshot": "[{\"title\": \"Publisher page\", \"url\": \"https://www.sciencedirect.com/science/article/pii/S1529943013015763\", \"publisher\": \"Elsevier / The Spine Journal\", \"accessed_at\": \"2025-09-17\", \"strength\": 3}, {\"title\": \"PubMed\", \"url\": \"https://pubmed.ncbi.nlm.nih.gov/24412032/\", \"publisher\": \"NLM / PubMed\", \"accessed_at\": \"2025-09-17\", \"strength\": 2}]"
}
