{
  "id": "10.1196/annals.1351.019",
  "theme": "non_classe",
  "type_etude": "inconnu",
  "message_clinique": "The objective of this article was to examine the female versus male perspective regarding prevalence/incidence, etiological factors, disease severity/outcomes, access to therapy and therapeutic responses.",
  "statut": "valide",
  "doi_url": "https://doi.org/10.1196/annals.1351.019",
  "pmid": "16855148",
  "publication_date": "2006-01-01",
  "last_verified": "2025-09-19",
  "retraction_status": "ok",
  "evidence_level": {
    "scale": "unknown",
    "value": "unknown",
    "justification": "The objective of this article was to examine the female versus male perspective regarding prevalence/incidence, etiological factors, disease severity/outcomes, access to therapy and therapeutic responses."
  },
  "sources_snapshot": "[{\"title\": \"Publisher page\", \"url\": \"https://doi.org/10.1196/annals.1351.019\", \"publisher\": \"Wiley\", \"accessed_at\": \"2025-09-19\", \"strength\": 3}, {\"title\": \"PubMed\", \"url\": \"https://pubmed.ncbi.nlm.nih.gov/16855148/\", \"publisher\": \"NLM / PubMed\", \"accessed_at\": \"2025-09-19\", \"strength\": 2}]"
}
