{
  "id": "10.1007/bf00268173",
  "theme": "non_classe",
  "type_etude": "inconnu",
  "message_clinique": "Étude par TDM de l’alignement rotationnel dans la gonarthrose. Non utile à la prise en charge MSK générale.",
  "statut": "valide",
  "doi_url": "https://doi.org/10.1007/bf00268173",
  "pmid": "4077342",
  "publication_date": "1985-01-01",
  "last_verified": "2025-09-19",
  "retraction_status": "ok",
  "evidence_level": {
    "scale": "unknown",
    "value": "unknown",
    "justification": "Étude par TDM de l’alignement rotationnel dans la gonarthrose. Non utile à la prise en charge MSK générale."
  },
  "sources_snapshot": "[{\"title\": \"Publisher page\", \"url\": \"https://doi.org/10.1007/bf00268173\", \"publisher\": \"Springer Science and Business Media LLC\", \"accessed_at\": \"2025-09-19\", \"strength\": 3}, {\"title\": \"PubMed\", \"url\": \"https://pubmed.ncbi.nlm.nih.gov/4077342/\", \"publisher\": \"NLM / PubMed\", \"accessed_at\": \"2025-09-19\", \"strength\": 2}]"
}
