{
  "id": "10.3390/jcm11010154",
  "theme": "douleur_epaule",
  "type_etude": "inconnu",
  "message_clinique": "Étude observationnelle liant étendue de la douleur et sensibilisation centrale dans l’épaule gelée. Aide au repérage des profils à risque.",
  "statut": "valide",
  "doi_url": "https://doi.org/10.3390/jcm11010154",
  "pmid": "35011895",
  "publication_date": "2021-01-01",
  "last_verified": "2025-09-19",
  "retraction_status": "ok",
  "evidence_level": {
    "scale": "unknown",
    "value": "unknown",
    "justification": "Étude observationnelle liant étendue de la douleur et sensibilisation centrale dans l’épaule gelée. Aide au repérage des profils à risque."
  },
  "sources_snapshot": "[{\"title\": \"Publisher page\", \"url\": \"https://doi.org/10.3390/jcm11010154\", \"publisher\": \"MDPI AG\", \"accessed_at\": \"2025-09-19\", \"strength\": 3}, {\"title\": \"PubMed\", \"url\": \"https://pubmed.ncbi.nlm.nih.gov/35011895/\", \"publisher\": \"NLM / PubMed\", \"accessed_at\": \"2025-09-19\", \"strength\": 2}]"
}
