{
  "id": "KI-015-07",
  "theme": "cervicalgie",
  "type_etude": "inconnu",
  "message_clinique": "Revue/synthèse de preuves du Task Force NPAD : évaluation de la douleur cervicale et troubles associés.",
  "statut": "valide",
  "doi_url": "https://doi.org/10.1097/brs.0b013e3181644ae8",
  "pmid": "18204385",
  "publication_date": "2008-01-01",
  "last_verified": "2025-09-18",
  "retraction_status": "ok",
  "evidence_level": {
    "scale": "unknown",
    "value": "unknown",
    "justification": "Revue/synthèse de preuves du Task Force NPAD : évaluation de la douleur cervicale et troubles associés."
  },
  "sources_snapshot": "[{\"title\": \"Publisher page\", \"url\": \"https://journals.lww.com/spinejournal/Fulltext/2008/02151/Assessment_of_Neck_Pain_and_Its_Associated.15.aspx\", \"publisher\": \"LWW / Spine\", \"accessed_at\": \"2025-09-17\", \"strength\": 3}, {\"title\": \"PubMed\", \"url\": \"https://pubmed.ncbi.nlm.nih.gov/18204385/\", \"publisher\": \"NLM / PubMed\", \"accessed_at\": \"2025-09-17\", \"strength\": 2}]"
}
