{
  "id": "10.1111/iep.12029",
  "theme": "pronostic",
  "type_etude": "inconnu",
  "message_clinique": "Modèle conceptuel de progression tendineuse. Pas de données cliniques MSK pertinentes pour ce tri.",
  "statut": "valide",
  "doi_url": "https://doi.org/10.1111/iep.12029",
  "pmid": "23837792",
  "publication_date": "2013-01-01",
  "last_verified": "2025-09-19",
  "retraction_status": "ok",
  "evidence_level": {
    "scale": "unknown",
    "value": "unknown",
    "justification": "Modèle conceptuel de progression tendineuse. Pas de données cliniques MSK pertinentes pour ce tri."
  },
  "sources_snapshot": "[{\"title\": \"Publisher page\", \"url\": \"https://doi.org/10.1111/iep.12029\", \"publisher\": \"Wiley\", \"accessed_at\": \"2025-09-19\", \"strength\": 3}, {\"title\": \"PubMed\", \"url\": \"https://pubmed.ncbi.nlm.nih.gov/23837792/\", \"publisher\": \"NLM / PubMed\", \"accessed_at\": \"2025-09-19\", \"strength\": 2}]"
}
