{
  "id": "10.7326/m18-1376",
  "theme": "pronostic",
  "type_etude": "inconnu",
  "message_clinique": "Outil d’évaluation du risque de biais des études de modèles prédictifs. Non probatoire clinique MSK.",
  "statut": "valide",
  "doi_url": "https://doi.org/10.7326/m18-1376",
  "pmid": "30596875",
  "publication_date": "2019-01-01",
  "last_verified": "2025-09-19",
  "retraction_status": "ok",
  "evidence_level": {
    "scale": "unknown",
    "value": "unknown",
    "justification": "Outil d’évaluation du risque de biais des études de modèles prédictifs. Non probatoire clinique MSK."
  },
  "sources_snapshot": "[{\"title\": \"Publisher page\", \"url\": \"https://doi.org/10.7326/m18-1376\", \"publisher\": \"American College of Physicians\", \"accessed_at\": \"2025-09-19\", \"strength\": 3}, {\"title\": \"PubMed\", \"url\": \"https://pubmed.ncbi.nlm.nih.gov/30596875/\", \"publisher\": \"NLM / PubMed\", \"accessed_at\": \"2025-09-19\", \"strength\": 2}]"
}
