{
  "id": "batch009_004",
  "theme": "therapie_manuelle",
  "type_etude": "inconnu",
  "message_clinique": "Chiropractic spinal manipulative therapy for a geriatric patient with low back pain and comorbidities",
  "statut": "brouillon",
  "doi_url": "https://doi.org/10.1016/j.jcm.2011.05.001",
  "pmid": "22942837",
  "sources_snapshot": "[{\"title\": \"Chiropractic spinal manipulative therapy for a geriatric patient with low back pain and comorbidities\", \"url\": \"https://www.sciencedirect.com/science/article/pii/S1556370711001672\", \"publisher\": \"Elsevier/ScienceDirect\", \"accessed_at\": \"2025-09-17\", \"strength\": 3}, {\"title\": \"Chiropractic spinal manipulative therapy for a geriatric patient with low back pain and comorbidities\", \"url\": \"https://pubmed.ncbi.nlm.nih.gov/22942837/\", \"publisher\": \"PubMed\", \"accessed_at\": \"2025-09-17\", \"strength\": 2}]"
}
