{
  "id": "10.2519/jospt.2017.7415",
  "theme": "lombalgie_non_specifique",
  "type_etude": "inconnu",
  "message_clinique": "Rechutes fréquentes après LBP mais estimations incertaines. Recadrer attentes et planifier autogestion.",
  "statut": "valide",
  "doi_url": "https://doi.org/10.2519/jospt.2017.7415",
  "pmid": "28355981",
  "publication_date": "2017-01-01",
  "last_verified": "2025-09-19",
  "retraction_status": "ok",
  "evidence_level": {
    "scale": "unknown",
    "value": "unknown",
    "justification": "Rechutes fréquentes après LBP mais estimations incertaines. Recadrer attentes et planifier autogestion."
  },
  "sources_snapshot": "[{\"title\": \"Publisher page\", \"url\": \"https://doi.org/10.2519/jospt.2017.7415\", \"publisher\": \"Journal of Orthopaedic & Sports Physical Therapy (JOSPT)\", \"accessed_at\": \"2025-09-19\", \"strength\": 3}, {\"title\": \"PubMed\", \"url\": \"https://pubmed.ncbi.nlm.nih.gov/28355981/\", \"publisher\": \"NLM / PubMed\", \"accessed_at\": \"2025-09-19\", \"strength\": 2}]"
}
