{
  "id": "10.1007/s00038-019-01211-6",
  "theme": "non_classe",
  "type_etude": "inconnu",
  "message_clinique": "Étude coûts-maladie des troubles rachidiens au Brésil. Pas d’implication thérapeutique directe.",
  "statut": "valide",
  "doi_url": "https://doi.org/10.1007/s00038-019-01211-6",
  "pmid": "31093690",
  "publication_date": "2019-01-01",
  "last_verified": "2025-09-19",
  "retraction_status": "ok",
  "evidence_level": {
    "scale": "unknown",
    "value": "unknown",
    "justification": "Étude coûts-maladie des troubles rachidiens au Brésil. Pas d’implication thérapeutique directe."
  },
  "sources_snapshot": "[{\"title\": \"Publisher page\", \"url\": \"https://doi.org/10.1007/s00038-019-01211-6\", \"publisher\": \"Springer Science and Business Media LLC\", \"accessed_at\": \"2025-09-19\", \"strength\": 3}, {\"title\": \"PubMed\", \"url\": \"https://pubmed.ncbi.nlm.nih.gov/31093690/\", \"publisher\": \"NLM / PubMed\", \"accessed_at\": \"2025-09-19\", \"strength\": 2}]"
}
