{
  "id": "10.7759/cureus.25664",
  "theme": "non_classe",
  "type_etude": "inconnu",
  "message_clinique": "Analyse Google Trends en oncologie. Non pertinent MSK.",
  "statut": "valide",
  "doi_url": "https://doi.org/10.7759/cureus.25664",
  "pmid": "35812542",
  "publication_date": "2022-01-01",
  "last_verified": "2025-09-19",
  "retraction_status": "ok",
  "evidence_level": {
    "scale": "unknown",
    "value": "unknown",
    "justification": "Analyse Google Trends en oncologie. Non pertinent MSK."
  },
  "sources_snapshot": "[{\"title\": \"Publisher page\", \"url\": \"https://doi.org/10.7759/cureus.25664\", \"publisher\": \"Springer Science and Business Media LLC\", \"accessed_at\": \"2025-09-19\", \"strength\": 3}, {\"title\": \"PubMed\", \"url\": \"https://pubmed.ncbi.nlm.nih.gov/35812542/\", \"publisher\": \"NLM / PubMed\", \"accessed_at\": \"2025-09-19\", \"strength\": 2}]"
}
