{
  "id": "10.1016/s0140-6736%282300441-5",
  "theme": "non_classe",
  "type_etude": "inconnu",
  "message_clinique": "Here, we report a rare case of splenic infarction resulting from infective endocarditis, subsequently leading to the development of a splenic artery aneurysm three weeks post-surgery confirmed both by CTA and DSA.",
  "statut": "brouillon",
  "doi_url": "https://doi.org/10.1016/s0140-6736%282300441-5",
  "pmid": "40881048",
  "sources_snapshot": "[{\"title\": \"PubMed\", \"url\": \"https://pubmed.ncbi.nlm.nih.gov/40881048/\", \"publisher\": \"NLM / PubMed\", \"accessed_at\": \"2025-09-19\", \"strength\": 2}]"
}
