{
  "id": "10.1097/01.brs.0000214884.18502.93",
  "theme": "lombalgie_non_specifique",
  "type_etude": "inconnu",
  "message_clinique": "The McKenzie Method for Low Back Pain: A Systematic Review of the Literature With a Meta-Analysis Approach",
  "statut": "brouillon",
  "sources_snapshot": "[{\"title\": \"Spine journal page\", \"url\": \"https://journals.lww.com/spinejournal/abstract/2006/04200/the_mckenzie_method_for_low_back_pain__a.22.aspx\", \"publisher\": \"Spine (LWW)\", \"accessed_at\": \"2025-09-17\", \"strength\": 5}]"
}
