{
  "id": "batch010_007",
  "theme": "non_classe",
  "type_etude": "inconnu",
  "message_clinique": "Experimental and clinical applications of quantitative sensory testing",
  "statut": "brouillon",
  "doi_url": "https://doi.org/10.1016/j.jpain.2009.02.002",
  "pmid": "19380256",
  "sources_snapshot": "[{\"title\": \"Experimental and clinical applications of quantitative sensory testing\", \"url\": \"https://www.sciencedirect.com/science/article/pii/S152659000900371X\", \"publisher\": \"Elsevier/Journal site\", \"accessed_at\": \"2025-09-17\", \"strength\": 3}, {\"title\": \"Experimental and clinical applications of quantitative sensory testing\", \"url\": \"https://pubmed.ncbi.nlm.nih.gov/19380256/\", \"publisher\": \"PubMed\", \"accessed_at\": \"2025-09-17\", \"strength\": 2}]"
}
